Text,Question,Option A,Option B,Option C,Option D,Answer
"The activation of adaptive immunity begins with the recognition of antigens by lymphocytes.", "What starts the activation of adaptive immunity?", "The release of cytokines", "The recognition of antigens by lymphocytes", "The binding of antigens to B cells", "The activation of helper T cells", "The recognition of antigens by lymphocytes"
"Adaptive immunity is regulated by various checkpoints to ensure specificity and accuracy.", "How is adaptive immunity regulated?", "By increasing the number of T cells", "By various checkpoints ensuring specificity and accuracy", "By suppressing the immune system", "By inhibiting the activation of B cells", "By various checkpoints ensuring specificity and accuracy"
"Upon antigen recognition, T cells are activated through the presentation by antigen-presenting cells.", "How are T cells activated?", "By direct contact with pathogens", "Through the presentation of antigens by antigen-presenting cells", "By binding to B cells", "By cytokine release from B cells", "Through the presentation of antigens by antigen-presenting cells"
"The activation of B cells occurs when they bind to the same antigen.", "How are B cells activated?", "By the release of antibodies", "By binding to the same antigen", "Through cytokine signals from T cells", "By interaction with helper T cells", "By binding to the same antigen"
"Helper T cells release cytokines, which are essential for the full activation of B and T cells.", "What role do helper T cells play in adaptive immunity?", "They suppress immune responses", "They release cytokines for full activation of B and T cells", "They directly attack pathogens", "They activate macrophages", "They release cytokines for full activation of B and T cells"
"Regulation involves the inhibition of self-reactive cells to prevent autoimmunity.", "What is the purpose of regulation in adaptive immunity?", "To promote the activation of all immune cells", "To inhibit self-reactive cells and prevent autoimmunity", "To increase the speed of immune responses", "To stimulate the production of antibodies", "To inhibit self-reactive cells and prevent autoimmunity"
"Negative regulation is achieved through mechanisms such as clonal deletion and suppression by regulatory T cells.", "How is negative regulation of adaptive immunity achieved?", "By stimulating B cells", "Through clonal deletion and suppression by regulatory T cells", "By activating helper T cells", "By increasing the production of cytokines", "Through clonal deletion and suppression by regulatory T cells"
"Positive regulation includes the stimulation by cytokines and costimulation.", "What does positive regulation in adaptive immunity include?", "The suppression of self-reactive cells", "The stimulation by cytokines and costimulation", "The inhibition of T cell activity", "The promotion of innate immune responses", "The stimulation by cytokines and costimulation"
"The specificity of adaptive immunity is crucial for targeting pathogens without harming the host.", "Why is specificity important in adaptive immunity?", "To enhance the immune response", "To target pathogens without harming the host", "To make immune responses faster", "To prevent the activation of all immune cells", "To target pathogens without harming the host"
"Adaptive immunity memory allows for a faster and stronger response upon re-exposure to the same pathogen.", "What does adaptive immunity memory do?", "It helps in quicker pathogen recognition", "It allows for a faster and stronger response upon re-exposure to the same pathogen", "It decreases the immune response over time", "It reduces the production of cytokines", "It allows for a faster and stronger response upon re-exposure to the same pathogen"
"In contrast, innate immunity is non-specific and immediate but lacks memory.", "How does innate immunity differ from adaptive immunity?", "It is non-specific and immediate but lacks memory", "It is slower but more specific", "It requires antigen presentation", "It involves the activation of T and B cells", "It is non-specific and immediate but lacks memory"
"The balance between activation and regulation is vital for effective and safe immune responses.", "Why is the balance between activation and regulation important?", "To ensure effective immune responses and avoid damage", "To speed up the immune response", "To increase the production of antibodies", "To eliminate pathogens faster", "To ensure effective immune responses and avoid damage"
"Understanding these processes helps in developing better immunotherapies.", "Why is understanding immune system processes important?", "It helps in developing better immunotherapies", "It helps in diagnosing infections", "It improves exercise performance", "It enhances antibody production", "It helps in developing better immunotherapies"
"In summary, adaptive immunity activation and regulation involve complex interactions between various cells and signals.", "What is involved in the activation and regulation of adaptive immunity?", "Complex interactions between various cells and signals", "Only the action of B cells", "The inhibition of T cells", "The simple activation of immune cells", "Complex interactions between various cells and signals"
"These processes ensure that the immune system can effectively defend against pathogens while minimizing damage to the host.", "What is the outcome of adaptive immunity processes?", "A weaker immune response", "Effective defense against pathogens while minimizing host damage", "Excessive inflammation", "The activation of the body's digestive enzymes", "Effective defense against pathogens while minimizing host damage"
