Text,Question,Option A,Option B,Option C,Option D,Answer
"Anatomical terms of neuroanatomy are used to describe the structures and functions of the nervous system.","What do anatomical terms of neuroanatomy describe?","The structures and functions of the nervous system","The digestive system","The skeletal system","The circulatory system","The structures and functions of the nervous system"
"Terms like 'cortex,' 'medulla,' and 'cerebellum' refer to specific parts of the brain responsible for various functions like thinking, coordination, and reflexes.","What do terms like 'cortex,' 'medulla,' and 'cerebellum' refer to?","Specific parts of the brain","Specific types of neurons","Brainwave patterns","Cerebral spinal fluid","Specific parts of the brain"
"Neuroanatomy also uses directional terms like 'dorsal,' 'ventral,' 'rostral,' and 'caudal' to describe the positions of brain structures relative to each other.","What do directional terms like 'dorsal,' 'ventral,' 'rostral,' and 'caudal' describe?","The positions of brain structures relative to each other","The function of the brain regions","The size of the brain structures","The chemical composition of the brain","The positions of brain structures relative to each other"
"The term 'synapse' refers to the junction where nerve cells communicate with each other or with other tissues, such as muscles or glands.","What does the term 'synapse' refer to?","The junction where nerve cells communicate","The covering of the brain","The area where brain cells grow","The electrical impulse between neurons","The junction where nerve cells communicate"
"Understanding neuroanatomy terminology helps in diagnosing neurological conditions, such as stroke, Parkinson’s disease, and spinal cord injuries.","Why is understanding neuroanatomy terminology important?","It helps in diagnosing neurological conditions","It helps in diagnosing bone fractures","It helps in diagnosing heart conditions","It helps in diagnosing respiratory diseases","It helps in diagnosing neurological conditions"
"Different regions of the brain have specific roles, such as the frontal lobe (which controls decision-making) and the occipital lobe (which processes vision).","What is the role of the frontal lobe?","It controls decision-making","It controls balance","It processes vision","It regulates heart rate","It controls decision-making"
"Neuroanatomical terms are essential for accurately describing the nervous system’s complexity and aiding in clinical treatment and surgery.","Why are neuroanatomical terms essential?","For accurately describing the nervous system’s complexity","For increasing the speed of communication","For diagnosing digestive disorders","For enhancing lung capacity","For accurately describing the nervous system’s complexity"
"Terms like 'gray matter' and 'white matter' describe the composition of the central nervous system and its role in transmitting information.","What do terms like 'gray matter' and 'white matter' describe?","The composition of the central nervous system","The type of neurons in the brain","The volume of cerebrospinal fluid","The electrical signals in the brain","The composition of the central nervous system"
"The spinal cord is another key area in neuroanatomy, with terms like 'cervical,' 'thoracic,' and 'lumbar' referring to different sections of the cord.","What do terms like 'cervical,' 'thoracic,' and 'lumbar' refer to?","Different sections of the spinal cord","Different sections of the brain","Different types of nerve cells","Different types of neurological conditions","Different sections of the spinal cord"
"In conclusion, understanding anatomical terms of neuroanatomy is crucial for effective diagnosis and treatment of neurological conditions.","Why is understanding anatomical terms of neuroanatomy important?","For effective diagnosis and treatment of neurological conditions","For understanding muscle function","For treating infections","For studying genetics","For effective diagnosis and treatment of neurological conditions"
