Text,Question,Option A,Option B,Option C,Option D,Answer
"Bone remodeling is a continuous process where old bone tissue is replaced by new bone tissue.",What is the process of bone remodeling?,"Replacing old bone tissue with new bone tissue.","Regulating hormonal signals in the body.","Forming new muscles in the skeletal system.","Breaking down bone cells for energy.","Replacing old bone tissue with new bone tissue."
"Mechanical stress, such as the forces exerted during physical activity, plays a crucial role in regulating this process.",How does mechanical stress affect bone remodeling?,"It decreases bone strength.","It plays a crucial role in regulating bone remodeling.","It has no effect on bones.","It only affects the muscles.","It plays a crucial role in regulating bone remodeling."
"Without mechanical stress, bone resorption can exceed bone formation, leading to weakened bone structure.",What happens when there is no mechanical stress on bones?,"Bone formation exceeds resorption.","Bone resorption exceeds bone formation, leading to weak bones.","Bone density increases.","Bone structure remains unaffected.","Bone resorption exceeds bone formation, leading to weak bones."
"When the bone experiences increased load, osteoblast activity increases to form new bone tissue.",What occurs when a bone experiences increased load?,"Osteoblast activity decreases.","Osteoclast activity increases.","Osteoblast activity increases to form new bone tissue.","Hormonal activity is reduced.","Osteoblast activity increases to form new bone tissue."
"Similarly, when there is a decrease in mechanical stress, osteoclast activity may rise, resulting in bone resorption.",What happens when mechanical stress decreases?,"Osteoblast activity increases.","Osteoclast activity increases, leading to bone resorption.","Bone formation accelerates.","Bone density increases.","Osteoclast activity increases, leading to bone resorption."
"Bone remodeling is influenced by several factors, including mechanical stress, hormonal signals, and age.",Which factors influence bone remodeling?,"Mechanical stress, hormonal signals, and age.","Only mechanical stress and age.","Only hormonal signals and age.","Only mechanical stress.","Mechanical stress, hormonal signals, and age."
"Hormones such as parathyroid hormone (PTH) and calcitonin also regulate bone density by controlling osteoclast and osteoblast activity.",Which hormones regulate bone density?,"Insulin and cortisol.","Parathyroid hormone (PTH) and calcitonin.","Estrogen and progesterone.","Thyroid hormones and adrenaline.","Parathyroid hormone (PTH) and calcitonin."
"Interestingly, mechanical loading can stimulate the release of these hormones, which further modulate bone remodeling.",What does mechanical loading stimulate in bone remodeling?,"The release of hormones that modulate bone remodeling.","A decrease in osteoblast activity.","The process of muscle growth.","An increase in calcium production.","The release of hormones that modulate bone remodeling."
"Bone remodeling serves to maintain bone strength and integrity throughout a person's lifetime.",What is the main function of bone remodeling?,"To regulate body temperature.","To maintain bone strength and integrity throughout life.","To grow muscles in the body.","To enhance bone flexibility.","To maintain bone strength and integrity throughout life."
"For example, weight-bearing exercise can stimulate bone formation and improve bone density.",What can stimulate bone formation and improve bone density?,"Inactivity and rest.","Weight-bearing exercise.","Excessive calcium intake.","Only hormonal treatments.","Weight-bearing exercise."
"On the other hand, periods of disuse, such as bed rest, can lead to bone loss and increased risk of fractures.",What happens during periods of disuse, like bed rest?,"Bone loss and increased risk of fractures.","Increased bone density and strength.","No effect on bone health.","Growth of new bone tissue.","Bone loss and increased risk of fractures."
"The balance between bone resorption and bone formation is critical for maintaining skeletal health.",What is critical for maintaining skeletal health?,"Balance between muscle formation and fat breakdown.","Balance between bone resorption and bone formation.","Excessive bone resorption.","Only calcium intake.","Balance between bone resorption and bone formation."
"In osteoporosis, bone resorption outpaces bone formation, leading to weakened bones.",What happens in osteoporosis?,"Bone formation outpaces resorption.","Bone resorption outpaces bone formation, weakening bones.","Both bone formation and resorption stop.","Bone resorption and formation are balanced.","Bone resorption outpaces bone formation, weakening bones."
"Furthermore, as individuals age, bone remodeling slows down, which can contribute to bone fragility.",What happens to bone remodeling as people age?,"Bone remodeling speeds up.","Bone remodeling slows down, leading to fragility.","Bone remodeling stops completely.","Bone remodeling becomes more efficient.","Bone remodeling slows down, leading to fragility."
"Therefore, maintaining regular physical activity is crucial to support bone health and prevent bone loss.",Why is regular physical activity important for bones?,"To stimulate hormone release.","To support bone health and prevent bone loss.","To reduce calcium absorption.","To increase bone rigidity.","To support bone health and prevent bone loss."
"The role of mechanical stress is especially evident in athletes, whose bones are subjected to higher loads.",How is mechanical stress related to athletes?,"Their bones experience less stress.","Their bones are subjected to higher loads, which affects bone remodeling.","They don't experience any mechanical stress.","Their bones experience less bone density.","Their bones are subjected to higher loads, which affects bone remodeling."
"While mechanical stress is important, hormonal regulation provides additional control over the remodeling process.",What other factor, besides mechanical stress, controls bone remodeling?,"Hormonal regulation.","Nutritional factors.","Genetic factors only.","Age.","Hormonal regulation."
"Additionally, nutritional factors such as calcium and vitamin D also influence bone health.",Which nutritional factors influence bone health?,"Only vitamin D.","Calcium and vitamin D.","Calcium and iron.","Only calcium.","Calcium and vitamin D."
"Mechanical stress stimulates bone formation through a process known as mechanotransduction.",What is mechanotransduction?,"The process by which mechanical stress stimulates bone formation.","The process by which bones grow in length.","The process of absorbing calcium.","The process of muscle contraction.","The process by which mechanical stress stimulates bone formation."
"This process involves the conversion of mechanical signals into biochemical signals that regulate osteoblast activity.",What happens during mechanotransduction?,"Mechanical signals are converted into biochemical signals to regulate osteoblast activity.","Biochemical signals are converted into mechanical signals.","Osteoclasts become inactive.","Bone growth stops.","Mechanical signals are converted into biochemical signals to regulate osteoblast activity."
"Osteoblasts are responsible for synthesizing bone matrix, while osteoclasts break down bone tissue.",What do osteoblasts do?,"They break down bone tissue.","They synthesize bone matrix.","They regulate calcium levels.","They control bone density.","They synthesize bone matrix."
"Importantly, mechanical stress helps optimize the shape and strength of the bone in response to environmental factors.",What role does mechanical stress play in bone structure?,"It has no effect on bone structure.","It helps optimize the shape and strength of the bone in response to environmental factors.","It weakens the bone structure.","It causes bone loss.","It helps optimize the shape and strength of the bone in response to environmental factors."
"Moreover, hormonal signals, like estrogen, are critical in modulating bone turnover, particularly in women.",Which hormone is important for modulating bone turnover in women?,"Testosterone","Estrogen","Insulin","Thyroid hormones","Estrogen"
"Bone remodeling occurs more rapidly during periods of growth, such as childhood and adolescence.",When does bone remodeling occur more rapidly?,"During childhood and adolescence.","In older age.","During periods of rest.","When calcium is abundant.","During childhood and adolescence."
"In contrast, bone remodeling tends to slow with aging, particularly after menopause in women.",What happens to bone remodeling with aging?,"It speeds up.","It slows down, especially after menopause in women.","It becomes constant.","It stops completely.","It slows down, especially after menopause in women."
"Thus, the combination of mechanical stress and hormonal signals ensures the bones remain strong and adaptable to external forces.",What ensures bones remain strong and adaptable?,"Mechanical stress and hormonal signals.","Only hormonal signals.","Only mechanical stress.","Exercise and nutrition.","Mechanical stress and hormonal signals."
"Researchers are exploring therapies that can mimic mechanical loading or modulate hormonal pathways to treat bone-related disorders.",What are researchers exploring to treat bone-related disorders?,"Therapies that mimic mechanical loading or modulate hormonal pathways.","Exercise programs for athletes.","Calcium supplementation.","Bone surgery.","Therapies that mimic mechanical loading or modulate hormonal pathways."
"The overall effect of bone remodeling is to maintain the structural integrity of bones throughout life.",What is the overall effect of bone remodeling?,"To increase bone size.","To maintain the structural integrity of bones.","To reduce bone strength.","To alter bone shape.","To maintain the structural integrity of bones."
"Given its complexity, bone remodeling is influenced by genetic, environmental, and mechanical factors.",What influences bone remodeling?,"Genetic, environmental, and mechanical factors.","Only genetic factors.","Only mechanical stress.","Hormonal factors only.","Genetic, environmental, and mechanical factors."
"Overall, bone remodeling is a vital process that ensures bones remain adaptable and resilient to physical stress.",Why is bone remodeling vital?,"To ensure bones remain adaptable and resilient to physical stress.","To prevent calcium buildup.","To make bones larger.","To control muscle function.","To ensure bones remain adaptable and resilient to physical stress."
