Text,Question,Option A,Option B,Option C,Option D,Answer
"Parasitology is the study of parasites, their biology, and their impact on human health.","What does parasitology study?","Parasites, their biology, and impact on human health","Viruses and bacteria","Human diseases only","Infectious diseases caused by fungi","Parasites, their biology, and impact on human health"
"Parasites can cause a range of diseases, from mild gastrointestinal discomfort to life-threatening infections.","What can parasites cause?","Diseases ranging from mild discomfort to life-threatening infections","Only mild gastrointestinal discomfort","Only life-threatening infections","Skin rashes","Diseases ranging from mild discomfort to life-threatening infections"
"Parasitic infections are common in tropical and subtropical regions, though they can occur anywhere in the world.","Where are parasitic infections most common?","Tropical and subtropical regions","Arctic regions","Desert areas","Mountain regions","Tropical and subtropical regions"
"Common parasitic diseases include malaria, giardiasis, and schistosomiasis, each caused by different types of parasites.","Which of the following are common parasitic diseases?","Malaria, giardiasis, and schistosomiasis","Tuberculosis and influenza","HIV and measles","Chickenpox and smallpox","Malaria, giardiasis, and schistosomiasis"
"Parasites can live inside or on their host, feeding on tissues or fluids to sustain themselves.","Where do parasites live?","Inside or on their host","Only inside their host","Only on their host","In the environment around the host","Inside or on their host"
"Some parasites, such as tapeworms, are transmitted through contaminated food or water, while others, like lice, spread through direct contact.","How can parasites be transmitted?","Through contaminated food, water, or direct contact","Through airborne particles","Only through contaminated water","Only through direct contact","Through contaminated food, water, or direct contact"
"Parasitic infections can cause symptoms like fever, abdominal pain, and fatigue, depending on the type and location of the parasite.","What symptoms can parasitic infections cause?","Fever, abdominal pain, and fatigue","Cough and sore throat","Rashes and itching","Excessive sweating","Fever, abdominal pain, and fatigue"
"Treatment for parasitic infections often involves the use of anti-parasitic medications, such as antimalarial drugs or anthelmintics.","What is commonly used to treat parasitic infections?","Anti-parasitic medications like antimalarial drugs or anthelmintics","Antibiotics","Pain relievers","Vaccines","Anti-parasitic medications like antimalarial drugs or anthelmintics"
"Preventive measures, such as insecticide-treated bed nets, are widely used to reduce the spread of parasitic diseases like malaria.","What preventive measures are used for parasitic diseases like malaria?","Insecticide-treated bed nets","Antibiotics","Surgical procedures","Vaccines","Insecticide-treated bed nets"
"Some parasites can evade the immune system through complex life cycles or by altering their surface proteins to avoid detection.","How do some parasites evade the immune system?","By altering their surface proteins or having complex life cycles","By hiding in the bloodstream","By producing toxins","By reproducing rapidly","By altering their surface proteins or having complex life cycles"
"Parasitology is essential for understanding the life cycles of different parasites, which can help in developing better treatments and vaccines.","Why is parasitology important?","It helps understand the life cycles of parasites for better treatments and vaccines","It helps with the development of antibiotics","It focuses on the treatment of bacterial infections","It focuses only on preventive measures","It helps understand the life cycles of parasites for better treatments and vaccines"
"Research in parasitology also focuses on understanding the transmission dynamics of parasites to better control outbreaks.","What does parasitology research focus on besides life cycles?","Understanding the transmission dynamics of parasites","Treating viral diseases","The development of vaccines for bacteria","Identifying environmental risk factors","Understanding the transmission dynamics of parasites"
"Laboratory diagnostics in parasitology include microscopic examination of blood or stool samples to identify parasitic infections.","What is used for laboratory diagnostics in parasitology?","Microscopic examination of blood or stool samples","MRI scans","X-rays","Blood pressure measurements","Microscopic examination of blood or stool samples"
"Parasitologists work with public health officials to manage and control parasitic disease outbreaks, particularly in areas with poor sanitation.","Who do parasitologists work with to manage disease outbreaks?","Public health officials","Surgeons","Radiologists","Psychiatrists","Public health officials"
"Some parasitic infections are chronic and may require long-term treatment or management to prevent complications.","What is required for chronic parasitic infections?","Long-term treatment or management","Short-term antibiotics","Surgical removal of parasites","Immediate vaccination","Long-term treatment or management"
"In conclusion, parasitology plays a vital role in diagnosing, treating, and preventing parasitic diseases that affect human health.","What is the role of parasitology?","Diagnosing, treating, and preventing parasitic diseases","Only treating parasitic diseases","Focusing on bacterial infections","Only focusing on prevention","Diagnosing, treating, and preventing parasitic diseases"
